{
  "schema_version": "0.1",
  "segment_id": "mock_pair1",
  "source": "human",
  "model": null,
  "transcript": "I have led three projects in my last job",
  "words": [
    {
      "i": 0,
      "word": "I",
      "start": null,
      "end": null,
      "confidence": null
    },
    {
      "i": 1,
      "word": "have",
      "start": null,
      "end": null,
      "confidence": null
    },
    {
      "i": 2,
      "word": "led",
      "start": null,
      "end": null,
      "confidence": null
    },
    {
      "i": 3,
      "word": "three",
      "start": null,
      "end": null,
      "confidence": null
    },
    {
      "i": 4,
      "word": "projects",
      "start": null,
      "end": null,
      "confidence": null
    },
    {
      "i": 5,
      "word": "in",
      "start": null,
      "end": null,
      "confidence": null
    },
    {
      "i": 6,
      "word": "my",
      "start": null,
      "end": null,
      "confidence": null
    },
    {
      "i": 7,
      "word": "last",
      "start": null,
      "end": null,
      "confidence": null
    },
    {
      "i": 8,
      "word": "job",
      "start": null,
      "end": null,
      "confidence": null
    }
  ],
  "fluency": null,
  "feedback": [],
  "created_at": "2026-10-26T23:20:04Z"
}