{
  "schema_version": "0.1",
  "segment_id": "mock_pair4",
  "source": "whisper",
  "model": "openai/whisper-large-v3",
  "transcript": "He don't like the weekly meetings.",
  "words": [
    {
      "i": 0,
      "word": "He",
      "start": null,
      "end": null,
      "confidence": 0.95
    },
    {
      "i": 1,
      "word": "don't",
      "start": null,
      "end": null,
      "confidence": 0.95
    },
    {
      "i": 2,
      "word": "like",
      "start": null,
      "end": null,
      "confidence": 0.95
    },
    {
      "i": 3,
      "word": "the",
      "start": null,
      "end": null,
      "confidence": 0.95
    },
    {
      "i": 4,
      "word": "weekly",
      "start": null,
      "end": null,
      "confidence": 0.95
    },
    {
      "i": 5,
      "word": "meetings.",
      "start": null,
      "end": null,
      "confidence": 0.95
    }
  ],
  "fluency": null,
  "feedback": [
    {
      "flag_id": "mock_pair4:whisper:0",
      "type": "grammar",
      "rule_id": "HE_VERB_AGR",
      "category": "subject_verb_agreement",
      "word_start": 1,
      "word_end": 1,
      "text": "don't",
      "message": "The pronoun ‘he’ is usually used with a third-person or a past tense verb.",
      "suggestion": "does",
      "asr_confidence": 0.95,
      "label": null,
      "shown": true
    }
  ],
  "created_at": "2026-10-26T23:20:06Z"
}