{
  "schema_version": "0.1",
  "segment_id": "mock_pair5",
  "source": "whisper",
  "model": "openai/whisper-large-v3",
  "transcript": "Um, I think the deadline was too short.",
  "words": [
    {
      "i": 0,
      "word": "Um,",
      "start": null,
      "end": null,
      "confidence": 0.95
    },
    {
      "i": 1,
      "word": "I",
      "start": null,
      "end": null,
      "confidence": 0.95
    },
    {
      "i": 2,
      "word": "think",
      "start": null,
      "end": null,
      "confidence": 0.95
    },
    {
      "i": 3,
      "word": "the",
      "start": null,
      "end": null,
      "confidence": 0.95
    },
    {
      "i": 4,
      "word": "deadline",
      "start": null,
      "end": null,
      "confidence": 0.95
    },
    {
      "i": 5,
      "word": "was",
      "start": null,
      "end": null,
      "confidence": 0.95
    },
    {
      "i": 6,
      "word": "too",
      "start": null,
      "end": null,
      "confidence": 0.95
    },
    {
      "i": 7,
      "word": "short.",
      "start": null,
      "end": null,
      "confidence": 0.95
    }
  ],
  "fluency": null,
  "feedback": [],
  "created_at": "2026-10-26T23:20:06Z"
}