{
  "schema_version": "0.1",
  "segment_id": "mock_c001_s01_t0001",
  "source": "whisper",
  "model": "openai/whisper-large-v3",
  "transcript": "um I has led three projects in my last job",
  "words": [
    {
      "i": 0,
      "word": "um",
      "start": 0.1,
      "end": 0.42,
      "confidence": 0.61
    },
    {
      "i": 1,
      "word": "I",
      "start": 0.8,
      "end": 0.92,
      "confidence": 0.97
    },
    {
      "i": 2,
      "word": "has",
      "start": 0.92,
      "end": 1.15,
      "confidence": 0.38
    },
    {
      "i": 3,
      "word": "led",
      "start": 1.15,
      "end": 1.4,
      "confidence": 0.91
    },
    {
      "i": 4,
      "word": "three",
      "start": 1.4,
      "end": 1.7,
      "confidence": 0.96
    },
    {
      "i": 5,
      "word": "projects",
      "start": 1.7,
      "end": 2.25,
      "confidence": 0.95
    },
    {
      "i": 6,
      "word": "in",
      "start": 2.9,
      "end": 3.0,
      "confidence": 0.93
    },
    {
      "i": 7,
      "word": "my",
      "start": 3.0,
      "end": 3.15,
      "confidence": 0.98
    },
    {
      "i": 8,
      "word": "last",
      "start": 3.15,
      "end": 3.45,
      "confidence": 0.97
    },
    {
      "i": 9,
      "word": "job",
      "start": 3.45,
      "end": 3.8,
      "confidence": 0.96
    }
  ],
  "fluency": {
    "wpm": 157.9,
    "n_pauses": 2,
    "mean_pause_s": 0.52,
    "filler_count": 1
  },
  "feedback": [
    {
      "flag_id": "mock_c001_s01_t0001:whisper:0",
      "type": "filler",
      "rule_id": "FILLER_UM",
      "category": "filler",
      "word_start": 0,
      "word_end": 0,
      "text": "um",
      "message": "Filler word at the start of your answer.",
      "suggestion": null,
      "asr_confidence": 0.61,
      "label": "genuine",
      "shown": true
    },
    {
      "flag_id": "mock_c001_s01_t0001:whisper:1",
      "type": "grammar",
      "rule_id": "BASE_FORM",
      "category": "subject_verb_agreement",
      "word_start": 2,
      "word_end": 2,
      "text": "has",
      "message": "Possible agreement error — use the base form here.",
      "suggestion": "have",
      "asr_confidence": 0.38,
      "label": null,
      "shown": true
    }
  ],
  "created_at": "2026-10-20T12:00:00Z"
}